,rank,title,studio,box_office,year,actor1,actor2,actor3,actor4,female_lead,non_white_lead
481,482,Cloudy with a Chance of Meatballs,Sony,124870275,2009,Bill Hader, Anna Faris, James Caan, Andy Samberg,0,0
482,483,The Devil Wears Prada,Fox,124740460,2006,Meryl Streep, Anne Hathaway, Emily Blunt, Stanley Tucci,1,0
483,484,Something's Gotta Give,Sony,124728738,2003,Jack Nicholson, Diane Keaton, Keanu Reeves, Frances McDormand,0,0
484,485,Traffic,USA,124115725,2000,Benicio Del Toro, Jacob Vargas, Andrew Chavez, Michael Saucedo,0,0
485,486,The Birdcage,MGM,124060553,1996,Robin Williams, Gene Hackman, Nathan Lane, Dianne Wiest,0,0
486,487,City Slickers,Col.,124033791,1991,Billy Crystal, Daniel Stern, Bruno Kirby, Patricia Wettig,0,0
487,488,"Good Morning, Vietnam",BV,123922370,1987,Robin Williams, Forest Whitaker, Tung Thanh Tran, Chintara Sukapatana,0,0
488,489,Rango,Par.,123477607,2011,Johnny Depp, Isla Fisher, Abigail Breslin, Ned Beatty,0,0
489,490,Nutty Professor II: The Klumps,Uni.,123309890,2000,Eddie Murphy, Janet Jackson, Larry Miller, John Ales,0,1
490,491,The Good Dinosaur,BV,123087120,2015,Jeffrey Wright, Frances McDormand, Maleah Nipay-Padilla, Ryan Teeple,0,0
491,492,G.I. Joe: Retaliation,Par.,122523060,2013,Dwayne Johnson, Jonathan Pryce, Byung-hun Lee, Elodie Yung,0,1
492,493,Clear and Present Danger,Par.,122187717,1994,Harrison Ford, Willem Dafoe, Anne Archer, Joaquim de Almeida,0,0
493,494,The Hunt for Red October,Par.,122012643,1990,Sean Connery, Alec Baldwin, Scott Glenn, Sam Neill,0,0
494,495,The Bodyguard,WB,122006740,1992,Kevin Costner, Whitney Houston, Gary Kemp, Bill Cobbs,0,0
495,496,Wayne's World,Par.,121697323,1992,Mike Myers, Dana Carvey, Rob Lowe, Tia Carrere,0,0
496,497,The Bourne Identity,Uni.,121661683,2002,Matt Damon, Franka Potente, Chris Cooper, Clive Owen,0,0
497,498,Superbad,Sony,121463226,2007,Jonah Hill, Michael Cera, Christopher Mintz-Plasse, Bill Hader,0,0
498,499,Speed,Fox,121248145,1994,Keanu Reeves, Dennis Hopper, Sandra Bullock, Joe Morton,0,0
499,500,50 First Dates,Sony,120908074,2004,Adam Sandler, Drew Barrymore, Rob Schneider, Sean Astin,0,0
